{
  "$schema": "https://json-schema.org/draft/2020-12/schema",
  "additionalProperties": false,
  "properties": {
    "bundle_sha256": {
      "pattern": "^[0-9a-f]{64}$",
      "type": "string"
    },
    "error_code": {
      "enum": [
        null,
        "input_unavailable",
        "runtime_failure"
      ]
    },
    "ir_sha256": {
      "anyOf": [
        {
          "pattern": "^[0-9a-f]{64}$",
          "type": "string"
        },
        {
          "type": "null"
        }
      ]
    },
    "method_id": {
      "const": "ghidra-library-contract-bounds-v3"
    },
    "prediction": {
      "anyOf": [
        {
          "additionalProperties": false,
          "properties": {
            "decision": {
              "enum": [
                "vulnerable_CWE-121",
                "vulnerable_CWE-122",
                "not_vulnerable",
                "uncertain"
              ]
            },
            "evidence": {
              "items": {
                "pattern": "^0x(?:0|[1-9a-f][0-9a-f]{0,15})$",
                "type": "string"
              },
              "type": "array",
              "uniqueItems": true
            },
            "paths": {
              "minimum": 0,
              "type": "integer"
            },
            "reason_codes": {
              "items": {
                "enum": [
                  "heap_write_exceeds_allocation",
                  "all_selected_writes_accounted_for",
                  "unknown_stack_bound",
                  "unknown_destination",
                  "unknown_write_extent",
                  "unknown_allocation_size",
                  "unknown_string_extent",
                  "unknown_copy_source",
                  "nonlive_allocation",
                  "static_write_outside_export",
                  "static_write_not_writable",
                  "unsupported_pcode",
                  "unsupported_library_call",
                  "unsupported_output_format",
                  "argument_recovery",
                  "overlapping_memcpy",
                  "unresolved_call",
                  "unresolved_branch",
                  "recursive_call",
                  "call_depth_limit",
                  "cyclic_control_flow",
                  "incomplete_control_flow",
                  "step_limit",
                  "path_limit",
                  "entry_inside_function",
                  "unaccounted_native_write",
                  "unknown_read_address",
                  "stack_write_exceeds_inferred_extent",
                  "inferred_stack_object_extent",
                  "instruction_pcode_store_fallback",
                  "ambiguous_stack_layout",
                  "missing_stack_array_extent",
                  "unresolved_stack_offset",
                  "contract_resource_limit",
                  "invalid_element_count",
                  "unknown_contract_source",
                  "overlapping_string_copy",
                  "ablation_disabled_contract"
                ]
              },
              "minItems": 1,
              "type": "array",
              "uniqueItems": true
            },
            "status": {
              "enum": [
                "classified",
                "abstained"
              ]
            },
            "steps": {
              "minimum": 0,
              "type": "integer"
            },
            "write_checks": {
              "items": {
                "additionalProperties": false,
                "properties": {
                  "capacity": {
                    "type": [
                      "integer",
                      "null"
                    ]
                  },
                  "evidence": {
                    "items": {
                      "pattern": "^0x(?:0|[1-9a-f][0-9a-f]{0,15})$",
                      "type": "string"
                    },
                    "type": "array",
                    "uniqueItems": true
                  },
                  "offset": {
                    "type": [
                      "integer",
                      "null"
                    ]
                  },
                  "outcome": {
                    "enum": [
                      "unknown",
                      "within_bounds",
                      "exceeds_allocation",
                      "zero_extent",
                      "static_storage_write",
                      "exceeds_inferred_extent",
                      "within_inferred_extent"
                    ]
                  },
                  "region": {
                    "enum": [
                      "heap",
                      "stack",
                      "static",
                      "unknown"
                    ]
                  },
                  "site": {
                    "pattern": "^0x(?:0|[1-9a-f][0-9a-f]{0,15})$",
                    "type": "string"
                  },
                  "size": {
                    "type": [
                      "integer",
                      "null"
                    ]
                  },
                  "bound_basis": {
                    "enum": [
                      null,
                      "requested_allocation",
                      "inferred_stack_object_extent",
                      "recovered_scalar_slot"
                    ]
                  },
                  "object_offset": {
                    "type": [
                      "integer",
                      "null"
                    ]
                  }
                },
                "required": [
                  "site",
                  "region",
                  "offset",
                  "size",
                  "capacity",
                  "outcome",
                  "evidence",
                  "bound_basis",
                  "object_offset"
                ],
                "type": "object"
              },
              "type": "array"
            },
            "contract_events": {
              "type": "array",
              "items": {
                "type": "object",
                "additionalProperties": false,
                "required": [
                  "api",
                  "site",
                  "outcome"
                ],
                "properties": {
                  "api": {
                    "enum": [
                      "wmemset",
                      "wcslen",
                      "wcscpy",
                      "strcat",
                      "wprintf"
                    ]
                  },
                  "site": {
                    "type": "string",
                    "pattern": "^0x[0-9a-f]+$"
                  },
                  "outcome": {
                    "type": "string"
                  }
                }
              }
            }
          },
          "required": [
            "decision",
            "status",
            "reason_codes",
            "evidence",
            "write_checks",
            "steps",
            "paths",
            "contract_events"
          ],
          "type": "object"
        },
        {
          "type": "null"
        }
      ]
    },
    "schema_version": {
      "const": 3
    },
    "status": {
      "enum": [
        "lifted",
        "completed",
        "input_unavailable",
        "runtime_failed"
      ]
    }
  },
  "required": [
    "schema_version",
    "method_id",
    "bundle_sha256",
    "ir_sha256",
    "status",
    "prediction",
    "error_code"
  ],
  "title": "Bounded library contract baseline v3",
  "type": "object"
}
