{"bundle_sha256":"3dc93e34e1bd2046635e4c6dac60d357c2521d8a769ab0b5e6e5fd8d5c1be8bb","error_code":null,"ir_sha256":"ba43059f1b7a7e7dcb67c32a8e72125f4c3b6313cf13b78d41ce531b3c2c8427","method_id":"ghidra-library-contract-bounds-v3","prediction":{"contract_events":[],"decision":"uncertain","evidence":["0x4010b6","0x4010c0"],"paths":1,"reason_codes":["cyclic_control_flow"],"status":"abstained","steps":13,"write_checks":[{"bound_basis":null,"capacity":null,"evidence":["0x4010b6"],"object_offset":null,"offset":4210780,"outcome":"static_storage_write","region":"static","site":"0x4010b6","size":4},{"bound_basis":null,"capacity":null,"evidence":["0x4010c0"],"object_offset":null,"offset":4210780,"outcome":"static_storage_write","region":"static","site":"0x4010c0","size":4}]},"schema_version":3,"status":"completed"}
