{"bundle_sha256":"e8697195ae7bb4bbfb58acf2f468cd213fd2c99c0950c609996859605fb19497","error_code":null,"ir_sha256":"a7da95e7528b085ae0c6fe3acc667847d51ceac6597d02cce127fc414f689bbc","method_id":"ghidra-library-contract-bounds-v3","prediction":{"contract_events":[],"decision":"uncertain","evidence":["0x4011fa","0x401216"],"paths":2,"reason_codes":["instruction_pcode_store_fallback","missing_stack_array_extent"],"status":"abstained","steps":11,"write_checks":[{"bound_basis":null,"capacity":null,"evidence":["0x4010e6","0x4011fa"],"object_offset":null,"offset":4210808,"outcome":"static_storage_write","region":"static","site":"0x4011fa","size":4},{"bound_basis":null,"capacity":null,"evidence":["0x4010e6","0x401204","0x401209","0x40120c","0x401216"],"object_offset":null,"offset":-21,"outcome":"unknown","region":"stack","site":"0x401216","size":1}]},"schema_version":3,"status":"completed"}
