{"bundle_sha256":"b07e9a0615ea5e550b9b9fa40477f3a4c80908e8147d7f06b75a5bda67aa057e","error_code":null,"ir_sha256":"2f640d33527be77c8d8429673e34391cbb76069a4848b62371a31a6558d94ca1","method_id":"ghidra-library-contract-bounds-v3","prediction":{"contract_events":[{"api":"wmemset","outcome":"completed","site":"0x401204"}],"decision":"uncertain","evidence":["0x4011f1","0x401204","0x401209"],"paths":2,"reason_codes":["inferred_stack_object_extent","unresolved_stack_offset"],"status":"abstained","steps":34,"write_checks":[{"bound_basis":"inferred_stack_object_extent","capacity":396,"evidence":["0x4011d8","0x4011e4","0x4011e9","0x4011ec","0x401204","0x401262"],"object_offset":-424,"offset":0,"outcome":"within_inferred_extent","region":"stack","site":"0x401204","size":396},{"bound_basis":"recovered_scalar_slot","capacity":4,"evidence":["0x4011e4","0x4011e9","0x4011ec","0x401204","0x401209","0x401262"],"object_offset":-28,"offset":0,"outcome":"within_bounds","region":"stack","site":"0x401209","size":4},{"bound_basis":"requested_allocation","capacity":400,"evidence":["0x4011e4","0x4011e9","0x4011ec","0x4011f1","0x401262"],"object_offset":null,"offset":0,"outcome":"within_bounds","region":"heap","site":"0x4011f1","size":4}]},"schema_version":3,"status":"completed"}
