{"bundle_sha256":"dee68127f5573f9ff76b36b9f034d396eb2e1fca707410013323bfc7a69e7324","error_code":null,"ir_sha256":"6631b30156180fc6da3ff5bf6095cfe5970a203c278c24e7f216cd696da2500d","method_id":"ghidra-library-contract-bounds-v3","prediction":{"contract_events":[],"decision":"uncertain","evidence":["0x4011c1"],"paths":1,"reason_codes":["inferred_stack_object_extent","instruction_pcode_store_fallback","unsupported_pcode"],"status":"abstained","steps":5,"write_checks":[{"bound_basis":"inferred_stack_object_extent","capacity":112,"evidence":["0x4011c1","0x401259"],"object_offset":-120,"offset":0,"outcome":"within_inferred_extent","region":"stack","site":"0x4011c1","size":16}]},"schema_version":3,"status":"completed"}
