{"bundle_sha256":"d77d8c5a526ed243b878dbe080ffb5fe764586b6697108f54766e9c64f8156fd","error_code":null,"ir_sha256":"d9582e13f6aa6287cffaf80c47828518dc7148f0c8c17bd2a73fe19ed20bd5f5","method_id":"ghidra-library-contract-bounds-v3","prediction":{"contract_events":[{"api":"wmemset","outcome":"completed","site":"0x401203"},{"api":"wcscpy","outcome":"unknown_contract_source","site":"0x401275"}],"decision":"uncertain","evidence":["0x4011f1","0x401203","0x401217","0x40121b","0x401220","0x401225","0x40122a","0x40122f","0x401234","0x401239","0x40123e","0x401246","0x40124e","0x401256","0x40125e","0x401269"],"paths":1,"reason_codes":["inferred_stack_object_extent","unknown_contract_source"],"status":"abstained","steps":38,"write_checks":[{"bound_basis":"inferred_stack_object_extent","capacity":16,"evidence":["0x4010d6","0x401203","0x401217"],"object_offset":-616,"offset":0,"outcome":"within_inferred_extent","region":"stack","site":"0x401217","size":16},{"bound_basis":"inferred_stack_object_extent","capacity":16,"evidence":["0x4010d6","0x401203","0x40121b"],"object_offset":-600,"offset":0,"outcome":"within_inferred_extent","region":"stack","site":"0x40121b","size":16},{"bound_basis":"inferred_stack_object_extent","capacity":16,"evidence":["0x4010d6","0x401203","0x401220"],"object_offset":-584,"offset":0,"outcome":"within_inferred_extent","region":"stack","site":"0x401220","size":16},{"bound_basis":"inferred_stack_object_extent","capacity":16,"evidence":["0x4010d6","0x401203","0x401225"],"object_offset":-568,"offset":0,"outcome":"within_inferred_extent","region":"stack","site":"0x401225","size":16},{"bound_basis":"inferred_stack_object_extent","capacity":16,"evidence":["0x4010d6","0x401203","0x40122a"],"object_offset":-552,"offset":0,"outcome":"within_inferred_extent","region":"stack","site":"0x40122a","size":16},{"bound_basis":"inferred_stack_object_extent","capacity":16,"evidence":["0x4010d6","0x401203","0x40122f"],"object_offset":-536,"offset":0,"outcome":"within_inferred_extent","region":"stack","site":"0x40122f","size":16},{"bound_basis":"inferred_stack_object_extent","capacity":16,"evidence":["0x4010d6","0x401203","0x401234"],"object_offset":-520,"offset":0,"outcome":"within_inferred_extent","region":"stack","site":"0x401234","size":16},{"bound_basis":"inferred_stack_object_extent","capacity":16,"evidence":["0x4010d6","0x401203","0x401239"],"object_offset":-504,"offset":0,"outcome":"within_inferred_extent","region":"stack","site":"0x401239","size":16},{"bound_basis":"inferred_stack_object_extent","capacity":16,"evidence":["0x4010d6","0x401203","0x40123e"],"object_offset":-488,"offset":0,"outcome":"within_inferred_extent","region":"stack","site":"0x40123e","size":16},{"bound_basis":"inferred_stack_object_extent","capacity":16,"evidence":["0x4010d6","0x401203","0x401246"],"object_offset":-472,"offset":0,"outcome":"within_inferred_extent","region":"stack","site":"0x401246","size":16},{"bound_basis":"inferred_stack_object_extent","capacity":16,"evidence":["0x4010d6","0x401203","0x40124e"],"object_offset":-456,"offset":0,"outcome":"within_inferred_extent","region":"stack","site":"0x40124e","size":16},{"bound_basis":"inferred_stack_object_extent","capacity":16,"evidence":["0x4010d6","0x401203","0x401256"],"object_offset":-440,"offset":0,"outcome":"within_inferred_extent","region":"stack","site":"0x401256","size":16},{"bound_basis":"inferred_stack_object_extent","capacity":196,"evidence":["0x4010d6","0x4011fb","0x401203"],"object_offset":-408,"offset":0,"outcome":"within_inferred_extent","region":"stack","site":"0x401203","size":196},{"bound_basis":"recovered_scalar_slot","capacity":4,"evidence":["0x4010d6","0x401203","0x40125e"],"object_offset":-212,"offset":0,"outcome":"within_bounds","region":"stack","site":"0x40125e","size":4},{"bound_basis":"recovered_scalar_slot","capacity":8,"evidence":["0x4010d6","0x401203","0x401269"],"object_offset":-424,"offset":0,"outcome":"within_bounds","region":"stack","site":"0x401269","size":8},{"bound_basis":null,"capacity":null,"evidence":["0x4010d6","0x4011f1"],"object_offset":null,"offset":4210796,"outcome":"static_storage_write","region":"static","site":"0x4011f1","size":4}]},"schema_version":3,"status":"completed"}
