{"bundle_sha256":"e4c9cb2f9e998d3264f1025721f142bb8c8b920777c841eef767270b69619a39","error_code":null,"ir_sha256":"efacae82ff536e0544b13b03ac4bed00eff52cc2343f0e880b64194fc14a172d","method_id":"ghidra-library-contract-bounds-v3","prediction":{"contract_events":[],"decision":"uncertain","evidence":["0x401230"],"paths":0,"reason_codes":["unaccounted_native_write"],"status":"abstained","steps":0,"write_checks":[]},"schema_version":3,"status":"completed"}
