{"bundle_sha256":"0d49bccb6ea972a4f5931734a1a3feae57d663af3cfc54d05df66dbac62287d4","error_code":null,"ir_sha256":"cccd2895d65c81ddb72261a2a1834c6bcd151e574590e6a13972fc8f845a4b57","method_id":"ghidra-library-contract-bounds-v3","prediction":{"contract_events":[],"decision":"uncertain","evidence":["0x401271"],"paths":0,"reason_codes":["unaccounted_native_write"],"status":"abstained","steps":0,"write_checks":[]},"schema_version":3,"status":"completed"}
