{"bundle_sha256":"62e82d0b64198f8d212897e001bc9ba040bb19a116f64a2866b9a12743600271","error_code":null,"ir_sha256":"8f95e840b101a990fb7ab200aaa22241ccdf5783b4de6089785d0c4c6858b806","method_id":"ghidra-library-contract-bounds-v3","prediction":{"contract_events":[{"api":"wmemset","outcome":"completed","site":"0x401236"}],"decision":"uncertain","evidence":["0x4011f1","0x401203","0x40121c","0x401236","0x40123b"],"paths":2,"reason_codes":["inferred_stack_object_extent","instruction_pcode_store_fallback","unknown_copy_source"],"status":"abstained","steps":21,"write_checks":[{"bound_basis":"inferred_stack_object_extent","capacity":396,"evidence":["0x4011fe","0x401207","0x40120c","0x401222","0x401236","0x401291"],"object_offset":-424,"offset":0,"outcome":"within_inferred_extent","region":"stack","site":"0x401236","size":396},{"bound_basis":"recovered_scalar_slot","capacity":4,"evidence":["0x4011fe","0x401207","0x40120c","0x401236","0x40123b","0x401291"],"object_offset":-28,"offset":0,"outcome":"within_bounds","region":"stack","site":"0x40123b","size":4},{"bound_basis":"recovered_scalar_slot","capacity":8,"evidence":["0x4011f1","0x401291"],"object_offset":-16,"offset":0,"outcome":"within_bounds","region":"stack","site":"0x4011f1","size":8},{"bound_basis":"recovered_scalar_slot","capacity":8,"evidence":["0x4011fe","0x401203","0x401291"],"object_offset":-16,"offset":0,"outcome":"within_bounds","region":"stack","site":"0x401203","size":8},{"bound_basis":"requested_allocation","capacity":200,"evidence":["0x4011fe","0x401207","0x40120c","0x40121c","0x401291"],"object_offset":null,"offset":0,"outcome":"within_bounds","region":"heap","site":"0x40121c","size":4}]},"schema_version":3,"status":"completed"}
