{"bundle_sha256":"592a15b9c0c77df3e5b7968ac8bea2e851bd611537fcf5356fcb80390a0390f7","error_code":null,"ir_sha256":"1d79b3e0b4793950ac5aa68f122e83f2eb431b7aca56868218f896eef8cf84ef","method_id":"ghidra-library-contract-bounds-v3","prediction":{"contract_events":[],"decision":"uncertain","evidence":["0x40123f","0x401259"],"paths":0,"reason_codes":["unaccounted_native_write"],"status":"abstained","steps":0,"write_checks":[]},"schema_version":3,"status":"completed"}
