{"bundle_sha256":"5fdb093785e2c83eda04a9fc7a59bd99d0f94713e5bbd3b523f4529d672cb7aa","error_code":null,"ir_sha256":"14e3eddc4f80fa5411e0be1e8a808afafe47afdee6ffb134fa59d908dc23051e","method_id":"ghidra-library-contract-bounds-v3","prediction":{"contract_events":[],"decision":"uncertain","evidence":["0x4011e2","0x4011e7","0x401228","0x40122d"],"paths":0,"reason_codes":["unaccounted_native_write"],"status":"abstained","steps":0,"write_checks":[]},"schema_version":3,"status":"completed"}
