{"bundle_sha256":"ddd6059fe4c5efbb60be56749c10edc35926a8e3e417ea5ec158aa5bdf280401","error_code":null,"ir_sha256":"d4cba92df4b528e80ceb796479dfaf24cb5a2e26f490bd353d1894e45a9690f6","method_id":"ghidra-library-contract-bounds-v3","prediction":{"contract_events":[],"decision":"uncertain","evidence":["0x401246","0x401272"],"paths":0,"reason_codes":["unaccounted_native_write"],"status":"abstained","steps":0,"write_checks":[]},"schema_version":3,"status":"completed"}
