{"bundle_sha256":"284c685ca25ca0fdb1b0cfb5aea2bfa994d1e17f6e260025f137938ad957b1f0","error_code":null,"ir_sha256":"fd61e8f5dc2c78c6c329587d70aeebb429f29b3eb2030a299255504586007f3b","method_id":"ghidra-library-contract-bounds-v3","prediction":{"contract_events":[],"decision":"uncertain","evidence":["0x4011ce"],"paths":1,"reason_codes":["instruction_pcode_store_fallback","missing_stack_array_extent"],"status":"abstained","steps":2,"write_checks":[{"bound_basis":null,"capacity":null,"evidence":["0x4011ce","0x401227"],"object_offset":null,"offset":-16,"outcome":"unknown","region":"stack","site":"0x4011ce","size":8}]},"schema_version":3,"status":"completed"}
