{"bundle_sha256":"d00847ad89104ca61849ff915e13cffcae888c4c27ee0993e6f25b5ee735c6fb","error_code":null,"ir_sha256":"4930dbd65ed135b59706bf2d2cfdc998b2296cbc2f7cfcb4fdf7e1776f97a3fa","method_id":"ghidra-library-contract-bounds-v3","prediction":{"contract_events":[],"decision":"uncertain","evidence":["0x4011e8","0x401220","0x401226"],"paths":2,"reason_codes":["cyclic_control_flow","inferred_stack_object_extent"],"status":"abstained","steps":28,"write_checks":[{"bound_basis":"inferred_stack_object_extent","capacity":800,"evidence":["0x4011e1","0x4011f7","0x4011fc","0x4011ff","0x401220","0x401226","0x40130d"],"object_offset":-808,"offset":4,"outcome":"within_inferred_extent","region":"stack","site":"0x401226","size":4},{"bound_basis":"inferred_stack_object_extent","capacity":800,"evidence":["0x4011e1","0x4011f7","0x4011fc","0x4011ff","0x401220","0x40130d"],"object_offset":-808,"offset":0,"outcome":"within_inferred_extent","region":"stack","site":"0x401220","size":4},{"bound_basis":null,"capacity":null,"evidence":["0x4011e8","0x40130d"],"object_offset":null,"offset":4210808,"outcome":"static_storage_write","region":"static","site":"0x4011e8","size":4}]},"schema_version":3,"status":"completed"}
